{
    "id": "review-015-gualeguaychu-ana",
    "userId": "f47ac10b-58cc-4372-a567-0e02b2c3d482",
    "destinationId": "gualeguaychu",
    "title": "Referente turístico de Entre Ríos",
    "content": "Como profesional del turismo, puedo decir que Gualeguaychú es uno de los destinos más completos de la región. La combinación de Carnaval, termas, historia y naturaleza es única. La infraestructura turística es sólida, con buena variedad de alojamientos y restaurantes. Los eventos culturales son de alta calidad y la promoción turística es excelente. Es un modelo de desarrollo turístico que otras ciudades podrían seguir.",
    "rating": {
        "landscape": 5,
        "attractions": 5,
        "accessibility": 4,
        "safety": 5,
        "cleanliness": 5,
        "hospitality": 5,
        "culturalOffer": 5,
        "gastronomy": 5,
        "affordability": 4,
        "nightlife": 4,
        "infrastructure": 4,
        "environmentalCare": 5,
        "wifiAvailability": 4,
        "shopping": 4,
        "beaches": 4,
        "greenSpaces": 5,
        "localEvents": 5,
        "weatherSatisfaction": 5
    }
}