{
    "$schema": "../../../schemas/destinationReview.schema.json",
    "id": "026-destinationReview-paranacito",
    "userId": "013-user-patricia-ruiz",
    "destinationId": "008-destination-paranacito",
    "title": "Perfecto para turismo de naturaleza",
    "content": "Si buscas conectar con la naturaleza, este es tu Paraná Cito. Los paisajes son espectaculares, hay muchas actividades al aire libre y el ambiente es muy tranquilo. Ideal para fotografía y senderismo.",
    "rating": {
        "landscape": 5,
        "attractions": 4,
        "accessibility": 2,
        "safety": 4,
        "cleanliness": 5,
        "hospitality": 4,
        "culturalOffer": 3,
        "gastronomy": 3,
        "affordability": 5,
        "nightlife": 3,
        "infrastructure": 3,
        "environmentalCare": 5,
        "wifiAvailability": 3,
        "shopping": 3,
        "beaches": 3,
        "greenSpaces": 5,
        "localEvents": 4,
        "weatherSatisfaction": 5
    }
}
